{
  "artifactType": "E14FourDetectorGeneratedCandidateManifest",
  "authorizations": {
    "candidateEvaluationAuthorized": false,
    "candidateFittingAuthorized": false,
    "candidateRankingAuthorized": false,
    "crossMechanismCompositionAuthorized": false,
    "featureTransformationAuthorized": false,
    "manifestGenerationAuthorized": true,
    "outerOosAuthorized": false,
    "promotionAuthorized": false,
    "taxonomyMutationAuthorized": false
  },
  "candidateCount": 40,
  "candidateCountByMechanism": {
    "banking-credit": 16,
    "broad-market-repricing": 16,
    "cross-border-growth": 4,
    "funding-liquidity": 4
  },
  "candidates": [
    {
      "candidateId": "e14-banking-861dce1776f4",
      "detectorId": "e14-banking-credit-detector",
      "featureBindings": [
        {
          "fitScope": "inner-only",
          "seriesId": "e14-baa10y-monthly-maximum",
          "sourceId": "fred-baa10y",
          "transform": "causal-rolling-percentile"
        }
      ],
      "lifecycleStatus": "research-generated-not-fit",
      "mechanism": "banking-credit",
      "parameters": {
        "entryPersistenceMonths": 1,
        "hysteresisRequired": true,
        "minimumHistoryMonths": 60,
        "recoveryPersistenceMonths": 1,
        "thresholdDirection": "higher-is-more-stress",
        "thresholdQuantiles": [
          0.8,
          0.9,
          0.95
        ],
        "thresholdSelectionScope": "inner-train-within-leave-one-episode-out"
      },
      "profile": {
        "aggregator": "identity",
        "profileId": "baa10y-only",
        "seriesIds": [
          "e14-baa10y-monthly-maximum"
        ]
      }
    },
    {
      "candidateId": "e14-banking-df78bda67e3e",
      "detectorId": "e14-banking-credit-detector",
      "featureBindings": [
        {
          "fitScope": "inner-only",
          "seriesId": "e14-baa10y-monthly-maximum",
          "sourceId": "fred-baa10y",
          "transform": "causal-rolling-percentile"
        }
      ],
      "lifecycleStatus": "research-generated-not-fit",
      "mechanism": "banking-credit",
      "parameters": {
        "entryPersistenceMonths": 1,
        "hysteresisRequired": true,
        "minimumHistoryMonths": 60,
        "recoveryPersistenceMonths": 2,
        "thresholdDirection": "higher-is-more-stress",
        "thresholdQuantiles": [
          0.8,
          0.9,
          0.95
        ],
        "thresholdSelectionScope": "inner-train-within-leave-one-episode-out"
      },
      "profile": {
        "aggregator": "identity",
        "profileId": "baa10y-only",
        "seriesIds": [
          "e14-baa10y-monthly-maximum"
        ]
      }
    },
    {
      "candidateId": "e14-banking-4ec575533103",
      "detectorId": "e14-banking-credit-detector",
      "featureBindings": [
        {
          "fitScope": "inner-only",
          "seriesId": "e14-baa10y-monthly-maximum",
          "sourceId": "fred-baa10y",
          "transform": "causal-rolling-percentile"
        }
      ],
      "lifecycleStatus": "research-generated-not-fit",
      "mechanism": "banking-credit",
      "parameters": {
        "entryPersistenceMonths": 2,
        "hysteresisRequired": true,
        "minimumHistoryMonths": 60,
        "recoveryPersistenceMonths": 1,
        "thresholdDirection": "higher-is-more-stress",
        "thresholdQuantiles": [
          0.8,
          0.9,
          0.95
        ],
        "thresholdSelectionScope": "inner-train-within-leave-one-episode-out"
      },
      "profile": {
        "aggregator": "identity",
        "profileId": "baa10y-only",
        "seriesIds": [
          "e14-baa10y-monthly-maximum"
        ]
      }
    },
    {
      "candidateId": "e14-banking-63cec754717f",
      "detectorId": "e14-banking-credit-detector",
      "featureBindings": [
        {
          "fitScope": "inner-only",
          "seriesId": "e14-baa10y-monthly-maximum",
          "sourceId": "fred-baa10y",
          "transform": "causal-rolling-percentile"
        }
      ],
      "lifecycleStatus": "research-generated-not-fit",
      "mechanism": "banking-credit",
      "parameters": {
        "entryPersistenceMonths": 2,
        "hysteresisRequired": true,
        "minimumHistoryMonths": 60,
        "recoveryPersistenceMonths": 2,
        "thresholdDirection": "higher-is-more-stress",
        "thresholdQuantiles": [
          0.8,
          0.9,
          0.95
        ],
        "thresholdSelectionScope": "inner-train-within-leave-one-episode-out"
      },
      "profile": {
        "aggregator": "identity",
        "profileId": "baa10y-only",
        "seriesIds": [
          "e14-baa10y-monthly-maximum"
        ]
      }
    },
    {
      "candidateId": "e14-banking-73b05a51e27c",
      "detectorId": "e14-banking-credit-detector",
      "featureBindings": [
        {
          "fitScope": "inner-only",
          "seriesId": "e14-fdic-noncurrent-loan-rate-quarterly",
          "sourceId": "fdic-quarterly-financials",
          "transform": "causal-robust-z-score"
        }
      ],
      "lifecycleStatus": "research-generated-not-fit",
      "mechanism": "banking-credit",
      "parameters": {
        "entryPersistenceMonths": 1,
        "hysteresisRequired": true,
        "minimumHistoryMonths": 60,
        "recoveryPersistenceMonths": 1,
        "thresholdDirection": "higher-is-more-stress",
        "thresholdQuantiles": [
          0.8,
          0.9,
          0.95
        ],
        "thresholdSelectionScope": "inner-train-within-leave-one-episode-out"
      },
      "profile": {
        "aggregator": "identity",
        "profileId": "fdic-only",
        "seriesIds": [
          "e14-fdic-noncurrent-loan-rate-quarterly"
        ]
      }
    },
    {
      "candidateId": "e14-banking-745d2cf93e37",
      "detectorId": "e14-banking-credit-detector",
      "featureBindings": [
        {
          "fitScope": "inner-only",
          "seriesId": "e14-fdic-noncurrent-loan-rate-quarterly",
          "sourceId": "fdic-quarterly-financials",
          "transform": "causal-robust-z-score"
        }
      ],
      "lifecycleStatus": "research-generated-not-fit",
      "mechanism": "banking-credit",
      "parameters": {
        "entryPersistenceMonths": 1,
        "hysteresisRequired": true,
        "minimumHistoryMonths": 60,
        "recoveryPersistenceMonths": 2,
        "thresholdDirection": "higher-is-more-stress",
        "thresholdQuantiles": [
          0.8,
          0.9,
          0.95
        ],
        "thresholdSelectionScope": "inner-train-within-leave-one-episode-out"
      },
      "profile": {
        "aggregator": "identity",
        "profileId": "fdic-only",
        "seriesIds": [
          "e14-fdic-noncurrent-loan-rate-quarterly"
        ]
      }
    },
    {
      "candidateId": "e14-banking-ba40f5d12b8a",
      "detectorId": "e14-banking-credit-detector",
      "featureBindings": [
        {
          "fitScope": "inner-only",
          "seriesId": "e14-fdic-noncurrent-loan-rate-quarterly",
          "sourceId": "fdic-quarterly-financials",
          "transform": "causal-robust-z-score"
        }
      ],
      "lifecycleStatus": "research-generated-not-fit",
      "mechanism": "banking-credit",
      "parameters": {
        "entryPersistenceMonths": 2,
        "hysteresisRequired": true,
        "minimumHistoryMonths": 60,
        "recoveryPersistenceMonths": 1,
        "thresholdDirection": "higher-is-more-stress",
        "thresholdQuantiles": [
          0.8,
          0.9,
          0.95
        ],
        "thresholdSelectionScope": "inner-train-within-leave-one-episode-out"
      },
      "profile": {
        "aggregator": "identity",
        "profileId": "fdic-only",
        "seriesIds": [
          "e14-fdic-noncurrent-loan-rate-quarterly"
        ]
      }
    },
    {
      "candidateId": "e14-banking-76f919df3142",
      "detectorId": "e14-banking-credit-detector",
      "featureBindings": [
        {
          "fitScope": "inner-only",
          "seriesId": "e14-fdic-noncurrent-loan-rate-quarterly",
          "sourceId": "fdic-quarterly-financials",
          "transform": "causal-robust-z-score"
        }
      ],
      "lifecycleStatus": "research-generated-not-fit",
      "mechanism": "banking-credit",
      "parameters": {
        "entryPersistenceMonths": 2,
        "hysteresisRequired": true,
        "minimumHistoryMonths": 60,
        "recoveryPersistenceMonths": 2,
        "thresholdDirection": "higher-is-more-stress",
        "thresholdQuantiles": [
          0.8,
          0.9,
          0.95
        ],
        "thresholdSelectionScope": "inner-train-within-leave-one-episode-out"
      },
      "profile": {
        "aggregator": "identity",
        "profileId": "fdic-only",
        "seriesIds": [
          "e14-fdic-noncurrent-loan-rate-quarterly"
        ]
      }
    },
    {
      "candidateId": "e14-banking-69c313bb3c81",
      "detectorId": "e14-banking-credit-detector",
      "featureBindings": [
        {
          "fitScope": "inner-only",
          "seriesId": "e14-fdic-noncurrent-loan-rate-quarterly",
          "sourceId": "fdic-quarterly-financials",
          "transform": "causal-robust-z-score"
        },
        {
          "fitScope": "inner-only",
          "seriesId": "e14-baa10y-monthly-maximum",
          "sourceId": "fred-baa10y",
          "transform": "causal-rolling-percentile"
        }
      ],
      "lifecycleStatus": "research-generated-not-fit",
      "mechanism": "banking-credit",
      "parameters": {
        "entryPersistenceMonths": 1,
        "hysteresisRequired": true,
        "minimumHistoryMonths": 60,
        "recoveryPersistenceMonths": 1,
        "thresholdDirection": "higher-is-more-stress",
        "thresholdQuantiles": [
          0.8,
          0.9,
          0.95
        ],
        "thresholdSelectionScope": "inner-train-within-leave-one-episode-out"
      },
      "profile": {
        "aggregator": "maximum",
        "profileId": "joint-maximum",